{
  "$schema": "https://json-schema.org/draft/2019-09/schema",
  "type": "object",
  "properties": {
    "sqlVersion": {
      "type": "string",
      "description": "SQL version needed for the test. Defaults to latest."
    },
    "topic": {
      "type": "string",
      "description":"This is the AWS IoT MQTT topic that the input payload will be published on. The same topic must be used in the Rule SQL FROM clause. "
    },
    "inputPayload": {
      "anyOf": [
        {
          "type": "string"
        },
        {
          "type": "object"
        }
      ],
      "description":"This is the test input payload which will be published during the test execution. "
    },
    "inputSql": {
      "type": "string",
      "description":"This is the SQL statement of the IoT Rule under evaluation. "
    },
    "expectedOutput": {
      "anyOf": [
        {
          "type": "string"
        },
        {
          "type": "object"
        },
        {
          "type": "array"
        }
      ]
    },
    "description":"This is the expected output that the input payload will be transformed into after scenario validation execution. "

  },
  "required": [
    "topic",
    "inputPayload",
    "inputSql",
    "expectedOutput"
  ]
}